{
  "canonical_digest": "sha256:934bffc8feabae34e877b247bdfa41a5eecc24c6a2a89774640a9efac932f2ff",
  "component_id": "aset.model-gateway",
  "component_version": "0.1-rc1",
  "document_type": "aset-component-traceability",
  "links": [
    {
      "ADRRefs": "ADR-037",
      "DerivedRequirementID": "GW-001",
      "EvidenceLocator": "evidence/GW-001/",
      "ModelElementRefs": "MOD-GW",
      "NeedID": "NEED-006",
      "Result": "NOT_EXECUTED_PRE_IMPLEMENTATION",
      "SystemRequirementID": "SYS-005",
      "TraceStatus": "COMPLETE_FOR_DOCUMENTATION",
      "VerificationCaseID": "VC-GW-001"
    },
    {
      "ADRRefs": "ADR-037",
      "DerivedRequirementID": "GW-002",
      "EvidenceLocator": "evidence/GW-002/",
      "ModelElementRefs": "MOD-GW",
      "NeedID": "NEED-006",
      "Result": "NOT_EXECUTED_PRE_IMPLEMENTATION",
      "SystemRequirementID": "SYS-005",
      "TraceStatus": "COMPLETE_FOR_DOCUMENTATION",
      "VerificationCaseID": "VC-GW-002"
    },
    {
      "ADRRefs": "ADR-037",
      "DerivedRequirementID": "GW-003",
      "EvidenceLocator": "evidence/GW-003/",
      "ModelElementRefs": "MOD-GW",
      "NeedID": "NEED-006",
      "Result": "NOT_EXECUTED_PRE_IMPLEMENTATION",
      "SystemRequirementID": "SYS-005",
      "TraceStatus": "COMPLETE_FOR_DOCUMENTATION",
      "VerificationCaseID": "VC-GW-003"
    },
    {
      "ADRRefs": "ADR-037",
      "DerivedRequirementID": "GW-004",
      "EvidenceLocator": "evidence/GW-004/",
      "ModelElementRefs": "MOD-GW",
      "NeedID": "NEED-011",
      "Result": "NOT_EXECUTED_PRE_IMPLEMENTATION",
      "SystemRequirementID": "SYS-010",
      "TraceStatus": "COMPLETE_FOR_DOCUMENTATION",
      "VerificationCaseID": "VC-GW-004"
    },
    {
      "ADRRefs": "ADR-037",
      "DerivedRequirementID": "GW-005",
      "EvidenceLocator": "evidence/GW-005/",
      "ModelElementRefs": "MOD-GW",
      "NeedID": "NEED-017",
      "Result": "NOT_EXECUTED_PRE_IMPLEMENTATION",
      "SystemRequirementID": "SYS-017",
      "TraceStatus": "COMPLETE_FOR_DOCUMENTATION",
      "VerificationCaseID": "VC-GW-005"
    },
    {
      "ADRRefs": "ADR-037",
      "DerivedRequirementID": "GW-006",
      "EvidenceLocator": "evidence/GW-006/",
      "ModelElementRefs": "MOD-GW",
      "NeedID": "NEED-011",
      "Result": "NOT_EXECUTED_PRE_IMPLEMENTATION",
      "SystemRequirementID": "SYS-010",
      "TraceStatus": "COMPLETE_FOR_DOCUMENTATION",
      "VerificationCaseID": "VC-GW-006"
    },
    {
      "ADRRefs": "ADR-037",
      "DerivedRequirementID": "GW-007",
      "EvidenceLocator": "evidence/GW-007/",
      "ModelElementRefs": "MOD-GW",
      "NeedID": "NEED-008",
      "Result": "NOT_EXECUTED_PRE_IMPLEMENTATION",
      "SystemRequirementID": "SYS-011",
      "TraceStatus": "COMPLETE_FOR_DOCUMENTATION",
      "VerificationCaseID": "VC-GW-007"
    },
    {
      "ADRRefs": "ADR-037",
      "DerivedRequirementID": "GW-008",
      "EvidenceLocator": "evidence/GW-008/",
      "ModelElementRefs": "MOD-GW",
      "NeedID": "NEED-017",
      "Result": "NOT_EXECUTED_PRE_IMPLEMENTATION",
      "SystemRequirementID": "SYS-017",
      "TraceStatus": "COMPLETE_FOR_DOCUMENTATION",
      "VerificationCaseID": "VC-GW-008"
    },
    {
      "ADRRefs": "ADR-037;ADR-038",
      "DerivedRequirementID": "PMC-006",
      "EvidenceLocator": "evidence/PMC-006/",
      "ModelElementRefs": "SUB-PROMPT;ART-PROMPT;INV-PROMPT-001",
      "NeedID": "NEED-021",
      "Result": "NOT_EXECUTED_PRE_IMPLEMENTATION",
      "SystemRequirementID": "SYS-005",
      "TraceStatus": "COMPLETE_FOR_DOCUMENTATION",
      "VerificationCaseID": "VC-PMC-006"
    },
    {
      "ADRRefs": "ADR-037;ADR-038",
      "DerivedRequirementID": "PMC-007",
      "EvidenceLocator": "evidence/PMC-007/",
      "ModelElementRefs": "SUB-PROMPT;ART-PROMPT;INV-PROMPT-001",
      "NeedID": "NEED-021",
      "Result": "NOT_EXECUTED_PRE_IMPLEMENTATION",
      "SystemRequirementID": "SYS-005",
      "TraceStatus": "COMPLETE_FOR_DOCUMENTATION",
      "VerificationCaseID": "VC-PMC-007"
    }
  ],
  "schema_version": 1,
  "source_version": "1.5-rc11"
}
