{
  "canonical_digest": "sha256:dfdcba401494d6ad679b7aa85c07a2e64cfa31947a0a1f3d6b23fc5dcc3eaa11",
  "component_id": "aset.master",
  "component_version": "0.1-rc1",
  "document_type": "aset-component-traceability",
  "links": [
    {
      "ADRRefs": "ADR-029;ADR-035;ADR-038",
      "DerivedRequirementID": "MAS-001",
      "EvidenceLocator": "evidence/MAS-001/",
      "ModelElementRefs": "MOD-MASTER;CTX-MASTER;ART-EXPECTED",
      "NeedID": "NEED-010",
      "Result": "NOT_EXECUTED_PRE_IMPLEMENTATION",
      "SystemRequirementID": "SYS-009",
      "TraceStatus": "COMPLETE_FOR_DOCUMENTATION",
      "VerificationCaseID": "VC-MAS-001"
    },
    {
      "ADRRefs": "ADR-029;ADR-035;ADR-038",
      "DerivedRequirementID": "MAS-002",
      "EvidenceLocator": "evidence/MAS-002/",
      "ModelElementRefs": "MOD-MASTER;CTX-MASTER;ART-EXPECTED",
      "NeedID": "NEED-010",
      "Result": "NOT_EXECUTED_PRE_IMPLEMENTATION",
      "SystemRequirementID": "SYS-009",
      "TraceStatus": "COMPLETE_FOR_DOCUMENTATION",
      "VerificationCaseID": "VC-MAS-002"
    },
    {
      "ADRRefs": "ADR-029;ADR-035;ADR-038",
      "DerivedRequirementID": "MAS-003",
      "EvidenceLocator": "evidence/MAS-003/",
      "ModelElementRefs": "MOD-MASTER;CTX-MASTER;ART-EXPECTED",
      "NeedID": "NEED-010",
      "Result": "NOT_EXECUTED_PRE_IMPLEMENTATION",
      "SystemRequirementID": "SYS-009",
      "TraceStatus": "COMPLETE_FOR_DOCUMENTATION",
      "VerificationCaseID": "VC-MAS-003"
    },
    {
      "ADRRefs": "ADR-029;ADR-035;ADR-038",
      "DerivedRequirementID": "MAS-004",
      "EvidenceLocator": "evidence/MAS-004/",
      "ModelElementRefs": "MOD-MASTER;CTX-MASTER;ART-EXPECTED",
      "NeedID": "NEED-010",
      "Result": "NOT_EXECUTED_PRE_IMPLEMENTATION",
      "SystemRequirementID": "SYS-009",
      "TraceStatus": "COMPLETE_FOR_DOCUMENTATION",
      "VerificationCaseID": "VC-MAS-004"
    },
    {
      "ADRRefs": "ADR-029;ADR-035;ADR-038",
      "DerivedRequirementID": "MAS-005",
      "EvidenceLocator": "evidence/MAS-005/",
      "ModelElementRefs": "MOD-MASTER;CTX-MASTER;ART-EXPECTED",
      "NeedID": "NEED-010",
      "Result": "NOT_EXECUTED_PRE_IMPLEMENTATION",
      "SystemRequirementID": "SYS-009",
      "TraceStatus": "COMPLETE_FOR_DOCUMENTATION",
      "VerificationCaseID": "VC-MAS-005"
    },
    {
      "ADRRefs": "ADR-029;ADR-035;ADR-038",
      "DerivedRequirementID": "MAS-006",
      "EvidenceLocator": "evidence/MAS-006/",
      "ModelElementRefs": "MOD-MASTER;CTX-MASTER;ART-EXPECTED",
      "NeedID": "NEED-010",
      "Result": "NOT_EXECUTED_PRE_IMPLEMENTATION",
      "SystemRequirementID": "SYS-009",
      "TraceStatus": "COMPLETE_FOR_DOCUMENTATION",
      "VerificationCaseID": "VC-MAS-006"
    },
    {
      "ADRRefs": "ADR-029;ADR-035;ADR-038",
      "DerivedRequirementID": "MAS-007",
      "EvidenceLocator": "evidence/MAS-007/",
      "ModelElementRefs": "MOD-MASTER;CTX-MASTER;ART-EXPECTED",
      "NeedID": "NEED-015",
      "Result": "NOT_EXECUTED_PRE_IMPLEMENTATION",
      "SystemRequirementID": "SYS-015",
      "TraceStatus": "COMPLETE_FOR_DOCUMENTATION",
      "VerificationCaseID": "VC-MAS-007"
    },
    {
      "ADRRefs": "ADR-029;ADR-035;ADR-038",
      "DerivedRequirementID": "MAS-008",
      "EvidenceLocator": "evidence/MAS-008/",
      "ModelElementRefs": "MOD-MASTER;CTX-MASTER;ART-EXPECTED",
      "NeedID": "NEED-010",
      "Result": "NOT_EXECUTED_PRE_IMPLEMENTATION",
      "SystemRequirementID": "SYS-009",
      "TraceStatus": "COMPLETE_FOR_DOCUMENTATION",
      "VerificationCaseID": "VC-MAS-008"
    },
    {
      "ADRRefs": "ADR-029;ADR-035;ADR-038",
      "DerivedRequirementID": "MAS-009",
      "EvidenceLocator": "evidence/MAS-009/",
      "ModelElementRefs": "MOD-MASTER;CTX-MASTER;ART-EXPECTED",
      "NeedID": "NEED-010",
      "Result": "NOT_EXECUTED_PRE_IMPLEMENTATION",
      "SystemRequirementID": "SYS-009",
      "TraceStatus": "COMPLETE_FOR_DOCUMENTATION",
      "VerificationCaseID": "VC-MAS-009"
    },
    {
      "ADRRefs": "ADR-029;ADR-035;ADR-038",
      "DerivedRequirementID": "MAS-010",
      "EvidenceLocator": "evidence/MAS-010/",
      "ModelElementRefs": "MOD-MASTER;CTX-MASTER;ART-EXPECTED",
      "NeedID": "NEED-017",
      "Result": "NOT_EXECUTED_PRE_IMPLEMENTATION",
      "SystemRequirementID": "SYS-017",
      "TraceStatus": "COMPLETE_FOR_DOCUMENTATION",
      "VerificationCaseID": "VC-MAS-010"
    },
    {
      "ADRRefs": "ADR-029;ADR-035;ADR-038",
      "DerivedRequirementID": "MAS-011",
      "EvidenceLocator": "evidence/MAS-011/",
      "ModelElementRefs": "MOD-MASTER;CTX-MASTER;ART-EXPECTED",
      "NeedID": "NEED-008",
      "Result": "NOT_EXECUTED_PRE_IMPLEMENTATION",
      "SystemRequirementID": "SYS-011",
      "TraceStatus": "COMPLETE_FOR_DOCUMENTATION",
      "VerificationCaseID": "VC-MAS-011"
    },
    {
      "ADRRefs": "ADR-029;ADR-035;ADR-038",
      "DerivedRequirementID": "MAS-012",
      "EvidenceLocator": "evidence/MAS-012/",
      "ModelElementRefs": "MOD-MASTER;CTX-MASTER;ART-EXPECTED",
      "NeedID": "NEED-007",
      "Result": "NOT_EXECUTED_PRE_IMPLEMENTATION",
      "SystemRequirementID": "SYS-006",
      "TraceStatus": "COMPLETE_FOR_DOCUMENTATION",
      "VerificationCaseID": "VC-MAS-012"
    }
  ],
  "schema_version": 1,
  "source_version": "1.5-rc11"
}
